{
  "schema_version": "0.1.0",
  "comment_id": "01HXB0M9RT2YZ2K7N9DPBYK2WA",
  "subject": "sha256:8d0fc485abb2f9c96ae137f4d8fcfa7b98693a8b78b9871dea2e2ac5651aa667",
  "subject_kind": "capsule",
  "author": "m.ardebili",
  "body": "reran with key [REDACTED:api_key] \u2014 see logs",
  "created_at": "2026-07-12T09:14:02.101Z",
  "redaction_applied": true
}
