{
  "schema_version": "0.1.0",
  "comment_id": "01HXB0K3M7QM4YZ2K7N9DPBYK2",
  "subject": "sha256:8d0fc485abb2f9c96ae137f4d8fcfa7b98693a8b78b9871dea2e2ac5651aa667",
  "subject_kind": "capsule",
  "author": "m.ardebili",
  "body": "Output looks correct but retrieval pulled a stale doc \u2014 flagging.",
  "created_at": "2026-07-12T09:14:02.101Z",
  "tags": [
    "review",
    "blocked-promotion"
  ]
}
