{
  "schema_version": "0.1.0",
  "comment_id": "01HXB0M9RT2YZ2K7N9DPBYK2WA",
  "subject": "sha256:8d0fc485abb2f9c96ae137f4d8fcfa7b98693a8b78b9871dea2e2ac5651aa667",
  "subject_kind": "capsule",
  "author": "a.reviewer",
  "body": "Confirmed \u2014 re-run should be clean.",
  "created_at": "2026-07-12T09:14:02.101Z",
  "in_reply_to": "01HXB0K3M7QM4YZ2K7N9DPBYK2"
}
